{
  "schema_version": "1",
  "mechanism": {
    "parameters": {
      "k_cool.A": 0.03,
      "k_leak.A": 0.00194,
      "H.A": 2.2,
      "bias.A": 0.21,
      "k_cool.B": 0.042,
      "k_leak.B": 0.00138,
      "H.B": 1.6,
      "bias.B": -1.44,
      "k_cool.C": 0.109,
      "k_leak.C": 0.00127,
      "H.C": 2.4,
      "bias.C": -0.74,
      "k_cool.D": 0.109,
      "k_leak.D": 0.0012,
      "H.D": 2.2,
      "bias.D": 1.06,
      "k_cool.E": 0.125,
      "k_leak.E": 0.00091,
      "H.E": 1.5,
      "bias.E": 0.12,
      "k_cool.F": 0.098,
      "k_leak.F": 0.00113,
      "H.F": 1.3,
      "bias.F": 1.04,
      "door_gain": 7.4,
      "c_adj": 0.0003,
      "defrost.R_hours": 7,
      "defrost.len_min": 21,
      "defrost.heat_degC": 3.73,
      "trip.d_min": 9,
      "lockout.N": 3,
      "lockout.W_min": 45,
      "lockout.L_min": 240
    },
    "rules": {
      "defrost_rule_type": "runtime_hours",
      "adjacency_pairs": [
        [
          "A",
          "B"
        ],
        [
          "A",
          "C"
        ],
        [
          "A",
          "D"
        ],
        [
          "B",
          "F"
        ],
        [
          "C",
          "E"
        ],
        [
          "D",
          "F"
        ],
        [
          "D",
          "E"
        ]
      ],
      "stagger_order": [
        "C",
        "B",
        "F",
        "E",
        "D",
        "A"
      ]
    }
  },
  "notation": {
    "glossary": {
      "laki": "COIL_TEMP",
      "lino": "DISCH_PRESSURE",
      "dika": "OPEN",
      "rote": "DOOR",
      "nizi": "CLOSED",
      "lari": "FAULT",
      "tati": "TRIP",
      "lita": "ENTER",
      "nare": "DEFROST",
      "nido": "ON",
      "rete": "HEATER",
      "roto": "EXIT",
      "tere": "OFF",
      "tari": "RECOVERY",
      "sedo": "LOCKOUT",
      "tina": "BOOT",
      "nera": "FIRMWARE",
      "neke": "ABS",
      "zodo": "OVERFLOW",
      "kano": "QUEUE"
    },
    "affixes": {
      "to": "ZONE",
      "na": "ZONE",
      "si": "ZONE",
      "zi": "ZONE",
      "de": "ZONE",
      "ro": "ZONE",
      "ba": "ASPECT_EVENT",
      "be": "ASPECT_STATE"
    },
    "v34_change": "absolute_temp",
    "heldout": [
      {
        "seq": 746,
        "ts": "2026-03-05T23:35:00Z",
        "zone": "D",
        "event": "AIR_TEMP",
        "value": -22.3
      },
      {
        "seq": 747,
        "ts": "2026-03-05T23:40:00Z",
        "zone": "D",
        "event": "AIR_TEMP",
        "value": -22.9
      },
      {
        "seq": 748,
        "ts": "2026-03-05T23:45:00Z",
        "zone": "D",
        "event": "AIR_TEMP",
        "value": -22.7
      },
      {
        "seq": 749,
        "ts": "2026-03-05T23:50:00Z",
        "zone": "D",
        "event": "AIR_TEMP",
        "value": -23.1
      },
      {
        "seq": 750,
        "ts": "2026-03-05T23:55:00Z",
        "zone": "D",
        "event": "AIR_TEMP",
        "value": -21.8
      },
      {
        "seq": 751,
        "ts": "2026-03-06T00:00:00Z",
        "zone": "D",
        "event": "AIR_TEMP",
        "value": -22.0
      },
      {
        "seq": 752,
        "ts": "2026-03-06T00:05:00Z",
        "zone": "D",
        "event": "AIR_TEMP",
        "value": -21.9
      },
      {
        "seq": 753,
        "ts": "2026-03-06T00:10:00Z",
        "zone": "D",
        "event": "AIR_TEMP",
        "value": -21.1
      },
      {
        "seq": 754,
        "ts": "2026-03-06T00:15:00Z",
        "zone": "D",
        "event": "AIR_TEMP",
        "value": -21.4
      },
      {
        "seq": 755,
        "ts": "2026-03-06T00:20:00Z",
        "zone": "D",
        "event": "AIR_TEMP",
        "value": -20.7
      },
      {
        "seq": 756,
        "ts": "2026-03-06T00:25:00Z",
        "zone": "D",
        "event": "AIR_TEMP",
        "value": -20.6
      },
      {
        "seq": 757,
        "ts": "2026-03-06T00:30:00Z",
        "zone": "D",
        "event": "AIR_TEMP",
        "value": -21.7
      },
      {
        "seq": 758,
        "ts": "2026-03-06T00:35:00Z",
        "zone": "D",
        "event": "AIR_TEMP",
        "value": -22.0
      },
      {
        "seq": 759,
        "ts": "2026-03-06T00:40:00Z",
        "zone": "D",
        "event": "AIR_TEMP",
        "value": -22.3
      },
      {
        "seq": 760,
        "ts": "2026-03-06T00:45:00Z",
        "zone": "D",
        "event": "AIR_TEMP",
        "value": -22.0
      },
      {
        "seq": 761,
        "ts": "2026-03-06T00:50:00Z",
        "zone": "D",
        "event": "AIR_TEMP",
        "value": -22.0
      },
      {
        "seq": 762,
        "ts": "2026-03-06T00:55:00Z",
        "zone": "D",
        "event": "AIR_TEMP",
        "value": -22.4
      },
      {
        "seq": 763,
        "ts": "2026-03-06T01:00:00Z",
        "zone": "D",
        "event": "AIR_TEMP",
        "value": -23.1
      },
      {
        "seq": 764,
        "ts": "2026-03-06T01:05:00Z",
        "zone": "D",
        "event": "AIR_TEMP",
        "value": -23.1
      },
      {
        "seq": 765,
        "ts": "2026-03-06T01:07:00Z",
        "zone": "D",
        "event": "DOOR",
        "value": null
      },
      {
        "seq": 766,
        "ts": "2026-03-06T01:10:00Z",
        "zone": "D",
        "event": "AIR_TEMP",
        "value": -22.0
      },
      {
        "seq": 767,
        "ts": "2026-03-06T01:15:00Z",
        "zone": "D",
        "event": "AIR_TEMP",
        "value": -20.6
      },
      {
        "seq": 768,
        "ts": "2026-03-06T01:20:00Z",
        "zone": "D",
        "event": "AIR_TEMP",
        "value": -19.0
      },
      {
        "seq": 769,
        "ts": "2026-03-06T01:21:00Z",
        "zone": "D",
        "event": "TRIP",
        "value": null
      },
      {
        "seq": 770,
        "ts": "2026-03-06T01:25:00Z",
        "zone": "D",
        "event": "AIR_TEMP",
        "value": -17.7
      },
      {
        "seq": 771,
        "ts": "2026-03-06T01:30:00Z",
        "zone": "D",
        "event": "AIR_TEMP",
        "value": -17.0
      },
      {
        "seq": 772,
        "ts": "2026-03-06T01:34:00Z",
        "zone": "D",
        "event": "TRIP",
        "value": null
      },
      {
        "seq": 773,
        "ts": "2026-03-06T01:35:00Z",
        "zone": "D",
        "event": "AIR_TEMP",
        "value": -16.1
      },
      {
        "seq": 774,
        "ts": "2026-03-06T01:40:00Z",
        "zone": "D",
        "event": "AIR_TEMP",
        "value": -14.7
      },
      {
        "seq": 775,
        "ts": "2026-03-06T01:42:00Z",
        "zone": "D",
        "event": "DEFROST",
        "value": null
      },
      {
        "seq": 776,
        "ts": "2026-03-06T01:45:00Z",
        "zone": "D",
        "event": "AIR_TEMP",
        "value": -13.1
      },
      {
        "seq": 777,
        "ts": "2026-03-06T01:50:00Z",
        "zone": "D",
        "event": "AIR_TEMP",
        "value": -11.1
      },
      {
        "seq": 778,
        "ts": "2026-03-06T01:55:00Z",
        "zone": "D",
        "event": "AIR_TEMP",
        "value": -8.5
      },
      {
        "seq": 779,
        "ts": "2026-03-06T02:00:00Z",
        "zone": "D",
        "event": "AIR_TEMP",
        "value": -5.9
      },
      {
        "seq": 780,
        "ts": "2026-03-06T02:03:00Z",
        "zone": "D",
        "event": "DEFROST",
        "value": null
      },
      {
        "seq": 781,
        "ts": "2026-03-06T02:05:00Z",
        "zone": "D",
        "event": "AIR_TEMP",
        "value": -5.2
      },
      {
        "seq": 782,
        "ts": "2026-03-06T02:10:00Z",
        "zone": "D",
        "event": "AIR_TEMP",
        "value": -5.2
      },
      {
        "seq": 783,
        "ts": "2026-03-06T02:11:00Z",
        "zone": "D",
        "event": "TRIP",
        "value": null
      },
      {
        "seq": 784,
        "ts": "2026-03-06T02:15:00Z",
        "zone": "D",
        "event": "AIR_TEMP",
        "value": -4.5
      },
      {
        "seq": 785,
        "ts": "2026-03-06T02:20:00Z",
        "zone": "D",
        "event": "AIR_TEMP",
        "value": -4.2
      },
      {
        "seq": 786,
        "ts": "2026-03-06T02:24:00Z",
        "zone": "D",
        "event": "TRIP",
        "value": null
      },
      {
        "seq": 787,
        "ts": "2026-03-06T02:25:00Z",
        "zone": "D",
        "event": "AIR_TEMP",
        "value": -4.1
      },
      {
        "seq": 788,
        "ts": "2026-03-06T02:30:00Z",
        "zone": "D",
        "event": "AIR_TEMP",
        "value": -2.7
      },
      {
        "seq": 789,
        "ts": "2026-03-06T02:35:00Z",
        "zone": "D",
        "event": "AIR_TEMP",
        "value": -2.5
      },
      {
        "seq": 791,
        "ts": "2026-03-06T02:37:00Z",
        "zone": "D",
        "event": "LOCKOUT",
        "value": null
      }
    ]
  },
  "causal_chain": {
    "affected_lots": [
      "lot:LN-20092",
      "lot:LN-22068",
      "lot:LN-22726",
      "lot:LN-23894",
      "lot:LN-24907",
      "lot:LN-25048",
      "lot:LN-25120",
      "lot:LN-25225",
      "lot:LN-25312",
      "lot:LN-27029",
      "lot:LN-27586",
      "lot:LN-27727",
      "lot:LN-28029",
      "lot:LN-28263",
      "lot:LN-28691",
      "lot:LN-28819",
      "lot:LN-29237",
      "lot:LN-29938"
    ],
    "excursion": {
      "zone": "D",
      "start": "2026-03-06T01:42:00Z",
      "end": "2026-03-06T11:17:00Z"
    }
  },
  "timeline": {
    "events": [],
    "clock_offsets_min": {
      "badge": 11,
      "exif": -7,
      "cctv": 4,
      "forklift": 0,
      "chat": 0,
      "tickets": 0,
      "git": 0,
      "submeter": 0,
      "gateway": 0,
      "probe": 0
    },
    "false_claims": []
  },
  "confidence": {
    "mechanism": 0.83,
    "notation": 0.98,
    "causal_chain": 0.72,
    "timeline": 0.7
  }
}